{
  "name": "webpage-to-markdown",
  "version": "1.0.0",
  "description": "Converts web pages to markdown format",
  "package": "./index.js",
  "type": "constructor",
  "dependencies": {},
  "initialization": {
    "className": "WebPageToMarkdown",
    "treatAsConstructor": true
  },
  "tools": [
    {
      "name": "webpage_convert",
      "description": "Convert a webpage to markdown format, preserving structure and formatting",
      "function": "convertToMarkdown",
      "instanceMethod": true,
      "async": true,
      "parameters": {
        "type": "object",
        "properties": {
          "url": {
            "type": "string",
            "description": "The URL of the webpage to convert"
          },
          "includeImages": {
            "type": "boolean",
            "description": "Whether to include image links in the markdown (default: true)",
            "default": true
          },
          "includeLinks": {
            "type": "boolean",
            "description": "Whether to preserve hyperlinks in the markdown (default: true)",
            "default": true
          },
          "maxLength": {
            "type": "number",
            "description": "Maximum length of the markdown output in characters (default: 50000)",
            "default": 50000
          },
          "waitForSelector": {
            "type": "string",
            "description": "Optional CSS selector to wait for before converting"
          }
        },
        "required": ["url"]
      },
      "resultMapping": {
        "success": {
          "url": "$.url",
          "markdown": "$.markdown",
          "title": "$.title",
          "wordCount": "$.wordCount",
          "truncated": "$.truncated"
        }
      }
    }
  ]
}