{
  "name": "server-starter",
  "version": "1.0.0",
  "description": "Starts and manages npm servers",
  "package": "./index.js",
  "type": "constructor",
  "dependencies": {},
  "initialization": {
    "className": "ServerStarter",
    "treatAsConstructor": true
  },
  "tools": [
    {
      "name": "server_start",
      "description": "Start an npm server with the specified command",
      "function": "start",
      "instanceMethod": true,
      "async": true,
      "parameters": {
        "type": "object",
        "properties": {
          "command": {
            "type": "string",
            "description": "The npm command to start the server (e.g., 'npm start', 'npm run dev')"
          },
          "cwd": {
            "type": "string",
            "description": "Optional working directory for the command (default: current directory)"
          }
        },
        "required": ["command"]
      },
      "resultMapping": {
        "success": {
          "pid": "$.pid",
          "command": "$.command",
          "cwd": "$.cwd",
          "status": "$.status"
        }
      }
    },
    {
      "name": "server_stop",
      "description": "Stop the running server",
      "function": "stop",
      "instanceMethod": true,
      "async": true,
      "parameters": {
        "type": "object",
        "properties": {},
        "required": []
      },
      "resultMapping": {
        "success": {
          "status": "$.status",
          "message": "$.message"
        }
      }
    },
    {
      "name": "server_read_output",
      "description": "Read the output from the running server",
      "function": "readServerOutput",
      "instanceMethod": true,
      "async": true,
      "parameters": {
        "type": "object",
        "properties": {
          "lines": {
            "type": "number",
            "description": "Number of lines to return from the end of the output (default: 50)",
            "default": 50
          }
        },
        "required": []
      },
      "resultMapping": {
        "success": {
          "output": "$.output",
          "totalLines": "$.totalLines"
        }
      }
    }
  ]
}