{
  "name": "lodash",
  "version": "1.0.0",
  "description": "Utility library module using lodash",
  "package": "lodash",
  "type": "static",
  "tools": [
    {
      "name": "array_chunk",
      "description": "Creates an array of elements split into groups the length of size",
      "function": "chunk",
      "instanceMethod": false,
      "parameters": {
        "type": "object",
        "properties": {
          "array": {
            "type": "array",
            "description": "The array to process"
          },
          "size": {
            "type": "integer",
            "description": "The length of each chunk",
            "default": 1
          }
        },
        "required": ["array"]
      }
    },
    {
      "name": "array_flatten",
      "description": "Flattens array a single level deep",
      "function": "flatten",
      "parameters": {
        "type": "object",
        "properties": {
          "array": {
            "type": "array",
            "description": "The array to flatten"
          }
        },
        "required": ["array"]
      }
    },
    {
      "name": "object_pick",
      "description": "Creates an object composed of the picked object properties",
      "function": "pick",
      "parameters": {
        "type": "object",
        "properties": {
          "object": {
            "type": "object",
            "description": "The source object"
          },
          "paths": {
            "type": "array",
            "items": {
              "type": "string"
            },
            "description": "The property paths to pick"
          }
        },
        "required": ["object", "paths"]
      }
    },
    {
      "name": "object_merge",
      "description": "Recursively merges own and inherited enumerable string keyed properties",
      "function": "merge",
      "parameters": {
        "type": "object",
        "properties": {
          "object": {
            "type": "object",
            "description": "The destination object"
          },
          "sources": {
            "type": "array",
            "items": {
              "type": "object"
            },
            "description": "The source objects"
          }
        },
        "required": ["object", "sources"]
      }
    },
    {
      "name": "collection_filter",
      "description": "Iterates over elements of collection, returning an array of all elements predicate returns truthy for",
      "function": "filter",
      "parameters": {
        "type": "object",
        "properties": {
          "collection": {
            "type": ["array", "object"],
            "description": "The collection to iterate over"
          },
          "predicate": {
            "type": "object",
            "description": "The object properties to match",
            "additionalProperties": true
          }
        },
        "required": ["collection", "predicate"]
      }
    },
    {
      "name": "string_camelcase",
      "description": "Converts string to camel case",
      "function": "camelCase",
      "parameters": {
        "type": "object",
        "properties": {
          "string": {
            "type": "string",
            "description": "The string to convert"
          }
        },
        "required": ["string"]
      },
      "resultMapping": {
        "transform": "raw"
      }
    },
    {
      "name": "math_sum",
      "description": "Computes the sum of the values in array",
      "function": "sum",
      "parameters": {
        "type": "object",
        "properties": {
          "array": {
            "type": "array",
            "items": {
              "type": "number"
            },
            "description": "The array to iterate over"
          }
        },
        "required": ["array"]
      },
      "resultMapping": {
        "transform": "raw"
      }
    }
  ]
}