{
  "name": "youtube-transcript",
  "version": "1.0.0",
  "description": "Fetches transcripts from YouTube videos",
  "package": "./index.js",
  "type": "constructor",
  "dependencies": {},
  "initialization": {
    "className": "YoutubeTranscript",
    "treatAsConstructor": true
  },
  "tools": [
    {
      "name": "youtube_get_transcript",
      "description": "Get the transcript/captions from a YouTube video",
      "function": "getTranscript",
      "instanceMethod": true,
      "async": true,
      "parameters": {
        "type": "object",
        "properties": {
          "videoUrl": {
            "type": "string",
            "description": "The YouTube video URL (e.g., 'https://www.youtube.com/watch?v=VIDEO_ID')"
          },
          "lang": {
            "type": "string",
            "description": "Language code for the transcript (default: 'en' for English)",
            "default": "en"
          }
        },
        "required": ["videoUrl"]
      },
      "resultMapping": {
        "success": {
          "videoUrl": "$.videoUrl",
          "videoId": "$.videoId",
          "language": "$.language",
          "transcript": "$.transcript",
          "fullText": "$.fullText",
          "duration": "$.duration"
        }
      }
    }
  ]
}